Unnamed: 0,header,NumberofInstances,Area,NumberofAttributes,DateDonated,MissingValues,NumberofWebHits,multivariate_data,time_series_data,data_generator_data,domain_theory_data,image_data,relational_data,sequential_data,spatial_data,univariate_data,spatio_temporal_data,text_data,transactional_data,num_data_characteristics,categorical_attributes,real_attributes,integer_attributes,no_listed_attributes,num_attribute_characteristics,causal_discover_task,classification_task,regression_task,function_learning_task,reccomendation_task,description_task,relational_learning_task,no_given_task,clustering_task,num_associated_tasks,source_institution_places,year_donated,year_month_donated,DatasetAge,DatapointCount
115,EMG data for gestures Data Set,30000,Life,6,1/7/2019,No,48587,0,1,0,0,0,0,0,0,0,0,0,0,1,0,1,0,0,1,0,1,0,0,0,0,0,0,0,1,"[['Universidad Complutense de Madrid', 'Madrid', 'Spain', 'ESP'], ['Lobachevsky State University of Nizhny Novgorod', 'Nizhny Novgorod', 'Russia', 'RUS']]",2019,1-2019,1,180000
116,Hepatitis Data Set,155,Life,19,11/1/1988,Yes,256793,1,0,0,0,0,0,0,0,0,0,0,0,1,1,1,1,0,3,0,1,0,0,0,0,0,0,0,3,"[['Jozef Stefan Institute', 'Ljubljana', 'Slovenia', 'SVN'], ['Carnegie-Mellon University', 'Pittsburgh, PA', 'United States', 'USA']]",1988,11-1988,32,2945
117,Syskill and Webert Web Page Ratings Data Set,332,Computer,5,10/20/1998,No,67595,1,0,0,0,0,0,0,0,0,0,1,0,1,1,0,0,0,1,0,1,0,0,0,0,0,0,0,1,"[['University of California, Irvine', 'Irvine, CA', 'United States', 'USA']]",1998,10-1998,22,1660
118,Australian Sign Language signs (High Quality) Data Set,2565,Other,22,2/26/2002,No,112305,1,1,0,0,0,0,0,0,0,0,0,0,2,0,1,0,0,1,0,1,0,0,0,0,0,0,0,1,"[['University of Sydney', 'Sydney', 'Australia', 'AUS'], ['University of New South Wales', 'Sydney', 'Australia', 'AUS']]",2002,2-2002,18,56430
119,CalIt2 Building People Counts Data Set,10080,Other,4,12/1/2006,No,53914,1,1,0,0,0,0,0,0,0,0,0,0,2,1,0,1,0,2,0,0,0,0,0,0,0,1,0,2,"[['University of California, Irvine', 'Irvine, CA', 'United States', 'USA']]",2006,12-2006,14,40320
120,HEPMASS Data Set,10500000,Physical,28,1/28/2016,No,63325,1,0,0,0,0,0,0,0,0,0,0,0,1,0,1,0,0,1,0,1,0,0,0,0,0,0,0,1,"[['University of California, Irvine', 'Irvine, CA', 'United States', 'USA']]",2016,1-2016,4,294000000
122,Paper Reviews Data Set,405,Computer,10,10/23/2017,Yes,50255,0,0,0,0,0,0,0,0,0,0,1,0,0,0,0,1,0,1,0,1,1,0,0,0,0,0,0,1,"[['Universidad Católica del Norte', 'Antofagasta', 'Chile', 'CHL']]",2017,10-2017,3,4050
124,Demospongiae Data Set,503,Life,0,1/21/2010,Yes,55325,1,0,0,0,0,0,0,0,0,0,0,0,1,0,0,1,0,1,0,1,0,0,0,0,0,0,0,1,"[['Artificial Intelligence Research Institute - CSIC', 'Barcelona', 'Spain', 'ESP'], ['Spanish National Research Council', 'Girona', 'Spain', 'ESP']]",2010,1-2010,10,0
125,Roman Urdu Data Set Data Set,20000,Computer,2,8/29/2018,No,20633,0,0,0,0,0,0,0,0,0,0,1,0,0,0,0,0,1,1,0,1,0,0,0,0,0,0,0,1,"[['Shaheed Zulfiqar Ali Bhutto Institute of Science and Technology (SZABIST)', 'Karachi', 'Pakistan', 'PAK']]",2018,8-2018,2,40000
126,URL Reputation Data Set,2396130,Computer,3231961,10/15/2009,No,138461,1,1,0,0,0,0,0,0,0,0,0,0,2,0,1,1,0,2,0,1,0,0,0,0,0,0,0,2,"[['University of California, San Diego', 'San Diego, CA', 'United States', 'USA']]",2009,10-2009,11,7.74E+12
127,Dorothea Data Set,1950,Life,100000,2/29/2008,No,109176,1,0,0,0,0,0,0,0,0,0,0,0,1,0,0,1,0,1,0,1,0,0,0,0,0,0,0,1,"[['DuPont Pharmaceuticals Research Laboratories', 'Berkeley, CA', 'United States', 'USA'], ['University of South Carolina', 'Columbia, SC', 'United States', 'USA'], ['University of California, Berkeley', 'Berkeley, CA', 'United States', 'USA']]",2008,2-2008,12,195000000
128,UJI Pen Characters Data Set,1364,Computer,0,6/1/2007,No,97231,1,0,0,0,0,0,1,0,0,0,0,0,2,0,0,1,0,1,0,1,0,0,0,0,0,0,0,1,"[['Universitat Jaume I', 'Valencia', 'Spain', 'ESP']]",2007,6-2007,13,0
129,Urban Land Cover Data Set,168,Physical,148,3/27/2014,No,46854,1,0,0,0,0,0,0,0,0,0,0,0,1,0,0,0,1,1,0,1,0,0,0,0,0,0,0,1,"[['Institute for Global Environmental Strategies', 'Kamiyamaguchi', 'Japan', 'JPN']]",2014,3-2014,6,24864
130,Bias correction of numerical prediction model temperature forecast Data Set,7750,Physical,25,2/18/2020,Yes,14124,1,0,0,0,0,0,0,0,0,0,0,0,1,0,1,0,0,1,0,0,1,0,0,0,0,0,0,1,"[['Ulsan National Institute of Science and Technology (UNIST)', 'Ulsan', 'Korea, South', 'KOR']]",2020,2-2020,0,193750
131,Breast Cancer Coimbra Data Set,116,Life,10,3/6/2018,No,88384,1,0,0,0,0,0,0,0,0,0,0,0,1,0,0,1,0,1,0,1,0,0,0,0,0,0,0,1,"[['University Hospital Centre of Coimbra', 'Coimbra', 'Portugal', 'PRT'], ['University of Coimbra', 'Coimbra', 'Portugal', 'PRT']]",2018,3-2018,2,1160
132,Firm-Teacher_Clave-Direction_Classification Data Set,10800,Other,20,4/24/2015,No,28904,1,0,0,0,0,0,0,0,0,0,0,0,1,0,0,0,1,1,0,1,0,0,0,0,0,0,0,1,"[['Oregon Institute of Technology', 'Klamath Falls, OR', 'United States', 'USA'], ['Portland State University', 'Portland, OR', 'United States', 'USA']]",2015,4-2015,5,216000
133,PMU-UD Data Set,5180,Computer,9,8/5/2018,No,10405,0,0,0,0,0,0,0,0,1,0,0,0,1,0,0,0,1,1,0,1,0,0,0,0,0,0,0,1,"[['Prince Mohammad bin Fahd University', 'Al Khobar', 'Saudi Arabia', 'SAU']]",2018,8-2018,2,46620
134,Real-time Election Results: Portugal 2019 Data Set,21643,Social,29,12/5/2019,No,11800,1,1,0,0,0,0,0,0,0,0,1,0,2,0,1,1,0,2,0,0,1,0,0,0,0,0,0,2,"[['University of Porto', 'Porto', 'Portugal', 'PRT']]",2019,12-2019,1,627647
135,Turkiye Student Evaluation Data Set,5820,Other,33,9/1/2013,No,99876,1,0,0,0,0,0,0,0,0,0,0,0,1,0,0,0,1,1,0,1,0,0,0,0,0,0,1,1,"[['Rochester Institute of Technology', 'Rochester, NY', 'United States', 'USA'], ['Gazi University', 'Ankara', 'Turkey', 'TUR']]",2013,9-2013,7,192060
136,Online Retail II Data Set,1067371,Business,8,9/21/2019,Yes,71232,1,1,0,0,0,0,1,0,0,0,1,0,3,0,1,1,0,2,0,1,1,0,0,0,0,0,1,2,"[['London South Bank University', 'London', 'United Kingdom', 'GBR']]",2019,9-2019,1,8538968
137,Bike Sharing Dataset Data Set,17389,Social,16,12/20/2013,No,491007,0,0,0,0,0,0,0,0,1,0,0,0,1,0,1,1,0,2,0,0,1,0,0,0,0,0,0,2,"[['University of Porto', 'Porto', 'Portugal', 'PRT']]",2013,12-2013,7,278224
138,Gas sensor array under flow modulation Data Set,58,Computer,120432,9/10/2014,No,38476,1,1,0,0,0,0,0,0,0,0,0,0,2,0,1,0,0,1,0,1,1,0,0,0,0,0,0,1,"[['Universitat Politecnica de Catalunya', 'Barcelona', 'Spain', 'ESP'], ['University of California, San Diego', 'San Diego, CA', 'United States', 'USA']]",2014,9-2014,6,6985056
139,Tamilnadu Electricity Board Hourly Readings Data Set,45781,Life,5,12/22/2013,No,74033,1,0,0,0,0,0,0,0,0,0,0,0,1,0,1,0,0,1,0,1,1,0,0,0,0,0,1,1,,2013,12-2013,7,228905
140,YouTube Spam Collection Data Set,1956,Computer,5,3/26/2017,No,81581,0,0,0,0,0,0,0,0,0,0,1,0,0,0,0,0,1,1,0,1,0,0,0,0,0,0,0,1,"[['Google, Inc.', 'Mountain View, CA', 'United States', 'USA']]",2017,3-2017,3,9780
141,Bag of Words Data Set,8000000,Other,100000,3/12/2008,No,311733,0,0,0,0,0,0,0,0,0,0,1,0,0,0,0,1,0,1,0,0,0,0,0,0,0,0,1,1,"[['University of California, Irvine', 'Irvine, CA', 'United States', 'USA']]",2008,3-2008,12,8.00E+11
142,Eco-hotel Data Set,401,Business,1,7/23/2017,No,37241,0,0,0,0,0,0,0,0,0,0,1,0,0,0,0,0,1,1,0,0,0,0,0,0,0,1,0,1,,2017,7-2017,3,401
143,detection_of_IoT_botnet_attacks_N_BaIoT Data Set,7062606,Computer,115,3/19/2018,No,65524,1,0,0,0,0,0,1,0,0,0,0,0,2,0,1,0,0,1,0,1,0,0,0,0,0,0,1,1,"[['Ben-Gurion University of the Negev', 'Beersheba', 'Israel', 'ISR']]",2018,3-2018,2,812199690
144,OpinRank Review Dataset Data Set,0,Computer,0,7/26/2011,No,51010,0,0,0,0,0,0,0,0,0,0,1,0,0,0,0,0,1,1,0,0,0,0,0,0,0,1,0,1,"[['University of Illinois Urbana-Champaign', 'Champaign, IL', 'United States', 'USA']]",2011,7-2011,9,0
145,BitcoinHeistRansomwareAddressDataset Data Set,2916697,Computer,10,6/17/2020,No,3669,1,1,0,0,0,0,0,0,0,0,0,0,2,0,1,1,0,2,0,1,0,0,0,0,0,0,1,2,"[['University of Manitoba', 'Winnipeg', 'Canada', 'CAN'], ['University of Texas at Dallas', 'Dallas, TX', 'United States', 'USA']]",2020,6-2020,0,29166970
146,Repeat Consumption Matrices Data Set,130000,Computer,21000,3/22/2018,No,21013,1,0,0,0,0,0,0,0,0,0,0,0,1,0,1,0,0,1,0,0,0,0,0,0,0,0,1,1,"[['University of California, Irvine', 'Irvine, CA', 'United States', 'USA']]",2018,3-2018,2,2730000000
147,Restaurant & consumer data Data Set,138,Computer,47,8/4/2012,Yes,141767,1,0,0,0,0,0,0,0,0,0,0,0,1,0,0,0,1,1,0,0,0,0,0,0,0,1,0,1,"[['National Center for Research and Technological Development (CENIDET)', 'Cuernavaca', 'Mexico', 'MEX']]",2012,8-2012,8,6486
148,HIV-1 protease cleavage Data Set,6590,Life,1,4/25/2015,No,60295,1,0,0,0,0,0,0,0,0,0,0,0,1,1,0,0,0,1,0,1,0,0,0,0,0,0,0,1,"[['Halmstad University', 'Halmstad', 'Sweden', 'SWE']]",2015,4-2015,5,6590
149,Avila Data Set,20867,Computer,10,6/20/2018,No,31304,1,0,0,0,0,0,0,0,0,0,0,0,1,0,1,0,0,1,0,1,0,0,0,0,0,0,0,1,"[['University of Cassino and Southern Lazio', 'Cassino', 'Italy', 'ITA']]",2018,6-2018,2,208670
150,Chess (King-Rook vs. King-Pawn) Data Set,3196,Game,36,8/1/1989,No,116780,1,0,0,0,0,0,0,0,0,0,0,0,1,1,0,0,0,1,0,1,0,0,0,0,0,0,0,1,"[['Turing Institute in Glasgow', 'Glasgow', 'United Kingdom', 'GBR']]",1989,8-1989,31,115056
151,DrivFace Data Set,606,Computer,6400,5/26/2016,No,35735,1,0,0,0,0,0,0,0,0,0,0,0,1,0,1,0,0,1,0,1,1,0,0,0,0,0,1,1,"[['Universitat Autonoma de Barcelona', 'Barcelona', 'Spain', 'ESP']]",2016,5-2016,4,3878400
152,Website Phishing Data Set,1353,Computer,10,11/2/2016,No,83416,1,0,0,0,0,0,0,0,0,0,0,0,1,0,0,1,0,1,0,1,0,0,0,0,0,0,0,1,"[['Auckland Institute of Studies', 'Auckland', 'New Zealand', 'NZL']]",2016,11-2016,4,13530
153,Breast Cancer Wisconsin (Original) Data Set,699,Life,10,7/15/1992,Yes,610312,1,0,0,0,0,0,0,0,0,0,0,0,1,0,0,1,0,1,0,1,0,0,0,0,0,0,0,1,"[['University of South Carolina', 'Columbia, SC', 'United States', 'USA'], ['Johns-Hopkins University', 'Baltimore, MD', 'United States', 'USA'], ['University of Wisconsin', 'Madison, WI', 'United States', 'USA']]",1992,7-1992,28,6990
154,Low Resolution Spectrometer Data Set,531,Physical,102,3/1/1988,No,53000,1,0,0,0,0,0,0,0,0,0,0,0,1,0,1,1,0,2,0,1,0,0,0,0,0,0,0,2,"[['NASA', 'Washington, DC', 'United States', 'USA']]",1988,3-1988,32,54162
155,Reuter_50_50 Data Set,2500,Computer,10000,9/8/2011,No,65189,1,0,0,1,0,0,0,0,0,0,1,0,2,0,1,0,0,1,0,1,0,0,0,0,0,0,1,1,"[['National Engineering Research Center for E-Learning', 'Wuhan', 'China', 'CHN']]",2011,9-2011,9,25000000
156,Kinship Data Set,104,Social,12,7/1/1990,No,76204,0,0,0,0,0,1,0,0,0,0,0,0,1,1,0,0,0,1,0,0,0,0,0,0,1,0,0,1,,1990,7-1990,30,1248
157,Localization Data for Person Activity Data Set,164860,Life,8,11/3/2010,No,105864,0,1,0,0,0,0,1,0,1,0,0,0,3,0,1,0,0,1,0,1,0,0,0,0,0,0,0,1,"[['Jozef Stefan Institute', 'Ljubljana', 'Slovenia', 'SVN']]",2010,11-2010,10,1318880
158,Combined Cycle Power Plant Data Set,9568,Computer,4,3/26/2014,No,167823,1,0,0,0,0,0,0,0,0,0,0,0,1,0,1,0,0,1,0,0,1,0,0,0,0,0,0,1,"[['Namik Kemal University', 'Tekirda?', 'Turkey', 'TUR'], ['Bo?aziçi University', 'Istanbul', 'Turkey', 'TUR']]",2014,3-2014,6,38272
159,ISOLET Data Set,7797,Computer,617,9/12/1994,No,122817,1,0,0,0,0,0,0,0,0,0,0,0,1,0,1,0,0,1,0,1,0,0,0,0,0,0,0,1,"[['Oregon State University', 'Corvallis, OR', 'United States', 'USA']]",1994,9-1994,26,4810749
160,Audiology (Original) Data Set,226,Life,0,12/3/1987,Yes,110441,1,0,0,0,0,0,0,0,0,0,0,0,1,1,0,0,0,1,0,1,0,0,0,0,0,0,0,1,"[['University of Texas', 'Austin, TX', 'United States', 'USA']]",1987,12-1987,33,0
161,NYSK Data Set,10421,Social,7,10/11/2013,No,53307,1,0,0,0,0,0,1,0,0,0,1,0,2,0,0,0,1,1,0,0,0,0,0,0,0,0,1,1,"[['Bertin IT', 'Montigny', 'France', 'FRA']]",2013,10-2013,7,72947
162,Dataset for ADL Recognition with Wrist-worn Accelerometer Data Set,0,Computer,3,2/11/2014,No,78994,1,1,0,0,0,0,0,0,0,0,0,0,2,0,0,0,1,1,0,1,0,0,0,0,0,0,1,1,"[['University of Genoa', 'Genoa', 'Italy', 'ITA']]",2014,2-2014,6,0
163,Daily Demand Forecasting Orders Data Set,60,Business,13,11/21/2017,No,78216,0,1,0,0,0,0,0,0,0,0,0,0,1,0,0,1,0,1,0,0,1,0,0,0,0,0,0,1,"[['Universidade Nove de Julho', 'Sao Paulo', 'Brazil', 'BRA'], ['University of São Paulo', 'Sao Paulo', 'Brazil', 'BRA']]",2017,11-2017,3,780
164,Burst Header Packet (BHP) flooding attack on Optical Burst Switching (OBS) Network Data Set,1075,Computer,22,8/28/2017,No,30223,0,0,0,0,0,0,0,0,0,0,1,0,0,0,0,1,0,1,0,1,0,0,0,0,0,0,0,1,"[['University of South Carolina', 'Columbia, SC', 'United States', 'USA']]",2017,8-2017,3,23650
165,Parkinson Speech Dataset with  Multiple Types of Sound Recordings Data Set,1040,Life,26,6/12/2014,No,99046,1,0,0,0,0,0,0,0,0,0,0,0,1,0,1,1,0,2,0,1,1,0,0,0,0,0,0,2,"[['Bahcesehir University', 'Istanbul', 'Turkey', 'TUR'], ['Bogazici University', 'Istanbul', 'Turkey', 'TUR'], ['Istanbul University', 'Istanbul ', 'Turkey', 'TUR'], ['Gazi University', 'Ankara', 'Turkey', 'TUR'], ['Bo?aziçi University', 'Istanbul', 'Turkey', 'TUR']]",2014,6-2014,6,27040
166,Shuttle Landing Control Data Set,15,Physical,6,11/1/1988,No,103637,1,0,0,0,0,0,0,0,0,0,0,0,1,1,0,0,0,1,0,1,0,0,0,0,0,0,0,1,"[['NASA', 'Washington, DC', 'United States', 'USA'], ['Jozef Stefan Institute', 'Ljubljana', 'Slovenia', 'SVN']]",1988,11-1988,32,90
167,Statlog (Image Segmentation) Data Set,2310,Other,19,11/1/1990,No,61416,1,0,0,0,0,0,0,0,0,0,0,0,1,0,1,0,0,1,0,1,0,0,0,0,0,0,0,1,"[['University of Massachusetts', 'Amherst, MA', 'United States', 'USA']]",1990,11-1990,30,43890
168,Molecular Biology (Splice-junction Gene Sequences) Data Set,3190,Life,61,1/1/1992,No,101540,0,0,0,1,0,0,1,0,0,0,0,0,2,1,0,0,0,1,0,1,0,0,0,0,0,0,0,1,"[['University of South Carolina', 'Columbia, SC', 'United States', 'USA'], ['Rutgers University', 'New Brunswick, NJ', 'United States', 'USA']]",1992,1-1992,28,194590
169,Amazon Commerce reviews set Data Set,1500,Physical,10000,6/11/2011,No,198876,1,0,0,1,0,0,0,0,0,0,1,0,2,0,1,0,0,1,0,1,0,0,0,0,0,0,0,1,"[['National Engineering Research Center for E-Learning', 'Wuhan', 'China', 'CHN']]",2011,6-2011,9,15000000
170,User Identification From Walking Activity Data Set,0,Other,0,3/2/2014,No,73025,0,1,0,0,0,0,1,0,1,0,0,0,3,0,1,0,0,1,0,1,0,0,0,0,0,0,1,1,"[['Computer Vision Center', 'Barcelona', 'Spain', 'ESP']]",2014,3-2014,6,0
171,Query Analytics Workloads Dataset Data Set,260000,Computer,8,6/22/2019,No,13923,1,0,0,0,0,0,0,0,0,0,0,0,1,0,1,0,0,1,0,0,1,0,0,0,0,0,1,1,"[['University of Glasgow', 'Glasgow', 'United Kingdom', 'GBR']]",2019,6-2019,1,2080000
172,Abscisic Acid Signaling Network Data Set,300,Life,43,4/3/2008,No,56272,1,0,0,0,0,0,0,0,0,0,0,0,1,0,0,1,0,1,1,0,0,0,0,0,0,0,0,1,"[['CFD Research Corporation', 'Huntsville, AL', 'United States', 'USA']]",2008,4-2008,12,12900
173,Wilt Data Set,4889,Life,6,3/13/2014,No,59614,1,0,0,0,0,0,0,0,0,0,0,0,1,0,0,0,1,1,0,1,0,0,0,0,0,0,0,1,"[['Institute for Global Environmental Strategies', 'Kamiyamaguchi', 'Japan', 'JPN']]",2014,3-2014,6,29334
174,MoCap Hand Postures Data Set,78095,Computer,38,11/22/2016,Yes,21558,1,0,0,0,0,0,0,0,0,0,0,0,1,0,1,1,0,2,0,1,0,0,0,0,0,0,1,2,"[['Quinnipiac University', 'Hamden, CT', 'United States', 'USA'], ['Louisiana Tech University', 'Ruston, LA', 'United States', 'USA']]",2016,11-2016,4,2967610
176,Madelon Data Set,4400,Other,500,2/29/2008,No,135366,1,0,0,0,0,0,0,0,0,0,0,0,1,0,1,0,0,1,0,1,0,0,0,0,0,0,0,1,"[['University of California, Berkeley', 'Berkeley, CA', 'United States', 'USA']]",2008,2-2008,12,2200000
177,Contraceptive Method Choice Data Set,1473,Life,9,7/7/1997,No,194079,1,0,0,0,0,0,0,0,0,0,0,0,1,1,0,1,0,2,0,1,0,0,0,0,0,0,0,2,"[['University of South Carolina', 'Columbia, SC', 'United States', 'USA'], ['University of Wisconsin', 'Madison, WI', 'United States', 'USA']]",1997,7-1997,23,13257
178,Newspaper and magazine images segmentation dataset Data Set,101,Computer,0,7/15/2014,No,27601,0,0,0,0,0,0,0,0,0,0,0,0,0,0,0,0,1,1,0,1,0,0,0,0,0,0,0,1,"[['National Research Nuclear University MEPhI', 'Moscow', 'Russia', 'RUS']]",2014,7-2014,6,0
179,Chronic_Kidney_Disease Data Set,400,Other,25,7/3/2015,Yes,170935,1,0,0,0,0,0,0,0,0,0,0,0,1,0,1,0,0,1,0,1,0,0,0,0,0,0,0,1,"[['Alagappa University', 'Karaikudi', 'India', 'IND']]",2015,7-2015,5,10000
180,Bach Choral Harmony Data Set,5665,Other,17,5/20/2014,No,49594,0,0,0,0,0,0,1,0,0,0,0,0,1,0,0,0,1,1,0,1,0,0,0,0,0,0,0,1,"[['Universita di Torino', 'Turin', 'Italy', 'ITA']]",2014,5-2014,6,96305
181,Ultrasonic flowmeter diagnostics Data Set,540,Computer,173,1/13/2018,No,16637,1,0,0,0,0,0,0,0,0,0,0,0,1,0,1,0,0,1,0,1,0,0,0,0,0,0,0,1,"[['Coventry University', 'Coventry', 'United Kingdom', 'GBR']]",2018,1-2018,2,93420
182,KDC-4007 dataset Collection Data Set,4007,Computer,0,4/27/2017,No,31104,1,0,0,0,0,0,0,0,0,0,1,0,1,0,0,1,0,1,0,1,1,0,0,0,0,0,0,1,"[['University of Sulaimania', 'Kurdistan', 'Iraq', 'IRQ']]",2017,4-2017,3,0
183,Synthetic Control Chart Time Series Data Set,600,Other,0,6/8/1999,No,80071,0,1,0,0,0,0,0,0,0,0,0,0,1,0,1,0,0,1,0,1,0,0,0,0,0,0,1,1,"[['Aristotle University of Thessaloniki', 'Thessaloniki', 'Greece', 'GRC']]",1999,6-1999,21,0
184,First-order theorem proving Data Set,6118,Computer,51,4/17/2013,No,42987,1,0,0,0,0,0,0,0,0,0,0,0,1,0,1,0,0,1,0,1,0,0,0,0,0,0,0,1,"[['University of Cambridge', 'Cambridge', 'United Kingdom', 'GBR']]",2013,4-2013,7,312018
185,Online Retail Data Set,541909,Business,8,11/6/2015,No,489566,1,1,0,0,0,0,1,0,0,0,0,0,3,0,1,1,0,2,0,1,0,0,0,0,0,0,1,2,"[['London South Bank University', 'London', 'United Kingdom', 'GBR']]",2015,11-2015,5,4335272
186,Semeion Handwritten Digit Data Set,1593,Computer,256,11/11/2008,No,127767,1,0,0,0,0,0,0,0,0,0,0,0,1,0,0,1,0,1,0,1,0,0,0,0,0,0,0,1,"[['Semeion, Research Center of Sciences of Communication', 'Rome', 'Italy', 'ITA']]",2008,11-2008,12,407808
187,HTRU2 Data Set,17898,Physical,9,2/14/2017,No,61898,1,0,0,0,0,0,0,0,0,0,0,0,1,0,1,0,0,1,0,1,0,0,0,0,0,0,1,1,"[['University of Manchester', 'Manchester', 'United Kingdom', 'GBR']]",2017,2-2017,3,161082
188,Superconductivty Data Data Set,21263,Physical,81,10/12/2018,No,42447,1,0,0,0,0,0,0,0,0,0,0,0,1,0,1,0,0,1,0,0,1,0,0,0,0,0,0,1,"[['University of Pennsylvania', 'Philadelphia, PA', 'United States', 'USA']]",2018,10-2018,2,1722303
189,MiniBooNE particle identification Data Set,130065,Physical,50,12/13/2010,No,52085,1,0,0,0,0,0,0,0,0,0,0,0,1,0,1,0,0,1,0,1,0,0,0,0,0,0,0,1,"[['University of Michigan', 'Ann Arbor, MI', 'United States', 'USA']]",2010,12-2010,10,6503250
190,banknote authentication Data Set,1372,Computer,5,4/16/2013,No,252153,1,0,0,0,0,0,0,0,0,0,0,0,1,0,1,0,0,1,0,1,0,0,0,0,0,0,0,1,"[['University of Applied Sciences, Ostwestfalen-Lippe', 'Lemgo', 'Germany', 'DEU']]",2013,4-2013,7,6860
191,Zoo Data Set,101,Life,17,5/15/1990,No,320027,1,0,0,0,0,0,0,0,0,0,0,0,1,1,0,1,0,2,0,1,0,0,0,0,0,0,0,2,"[['University of Nottingham', 'Nottingham', 'United Kingdom', 'GBR']]",1990,5-1990,30,1717
192,Gas sensor arrays in open sampling settings Data Set,18000,Computer,1950000,6/5/2013,No,46026,1,1,0,0,0,0,0,0,0,0,0,0,2,0,1,0,0,1,0,1,0,0,0,0,0,0,0,1,"[['University of California, San Diego', 'San Diego, CA', 'United States', 'USA']]",2013,6-2013,7,35100000000
193,Gesture Phase Segmentation Data Set,9900,Other,50,6/18/2014,No,52373,1,1,0,0,0,0,1,0,0,0,0,0,3,0,1,0,0,1,0,1,0,0,0,0,0,0,1,1,"[['University of São Paulo', 'Sao Paulo', 'Brazil', 'BRA']]",2014,6-2014,6,495000
194,"USPTO Algorithm Challenge, run by NASA-Harvard Tournament Lab and TopCoder    Problem: Pat Data Set",306,Other,5,10/13/2013,No,33422,0,0,0,1,0,0,0,0,0,0,0,0,1,0,0,1,0,1,0,1,0,0,0,0,0,0,0,1,,2013,10-2013,7,1530
195,Record Linkage Comparison Patterns Data Set,5749132,Other,12,3/10/2011,Yes,80492,1,0,0,0,0,0,0,0,0,0,0,0,1,0,1,0,0,1,0,1,0,0,0,0,0,0,0,1,"[['Johannes Gutenberg University', 'Mainz', 'Germany', 'DEU']]",2011,3-2011,9,68989584
196,Facebook Comment Volume Dataset Data Set,40949,Other,54,3/11/2016,No,93028,1,0,0,0,0,0,0,0,0,0,0,0,1,0,1,1,0,2,0,0,1,0,0,0,0,0,0,2,"[['Lovely Professional University', 'Phagwara', 'India', 'IND']]",2016,3-2016,4,2211246
197,QSAR fish toxicity Data Set,908,Physical,7,9/23/2019,No,25505,1,0,0,0,0,0,0,0,0,0,0,0,1,0,1,0,0,1,0,0,1,0,0,0,0,0,0,1,"[['University of Milano', 'Milan', 'Italy', 'ITA']]",2019,9-2019,1,6356
198,microblogPCU Data Set,221579,Computer,20,3/17/2015,Yes,49525,1,0,0,0,0,0,1,0,1,0,1,0,3,0,1,1,0,2,1,1,0,0,0,0,0,0,0,2,"[[""Xi'an Jiaotong University"", ""Xi'an"", 'China', 'CHN']]",2015,3-2015,5,4431580
199,ISTANBUL STOCK EXCHANGE Data Set,536,Business,8,6/1/2013,No,136096,1,1,0,0,0,0,0,0,1,0,0,0,3,0,1,0,0,1,0,1,1,0,0,0,0,0,0,1,"[['University of Tennessee', 'Knoxville, TN', 'United States', 'USA']]",2013,6-2013,7,4288
200,Arcene Data Set,900,Life,10000,2/29/2008,No,133134,1,0,0,0,0,0,0,0,0,0,0,0,1,0,1,0,0,1,0,1,0,0,0,0,0,0,0,1,"[['University of California, Berkeley', 'Berkeley, CA', 'United States', 'USA']]",2008,2-2008,12,9000000
201,SkillCraft1 Master Table Dataset Data Set,3395,Game,20,10/22/2013,Yes,63836,1,0,0,0,0,0,0,0,0,0,0,0,1,0,1,1,0,2,0,0,1,0,0,0,0,0,0,2,"[['Simon Fraser University', 'Burnaby', 'Canada', 'CAN']]",2013,10-2013,7,67900
202,Acute Inflammations Data Set,120,Life,6,2/11/2009,No,175129,1,0,0,0,0,0,0,0,0,0,0,0,1,1,0,1,0,2,0,1,0,0,0,0,0,0,0,2,"[['Polish Academy of Sciences', 'Warszawa', 'Poland', 'POL']]",2009,2-2009,11,720
203,Movie Data Set,10000,Other,0,7/7/1999,Yes,209087,1,0,0,0,0,1,0,0,0,0,0,0,2,0,0,0,1,1,0,0,0,0,0,0,0,1,0,1,"[['Stanford University', 'Stanford, CA', 'United States', 'USA']]",1999,7-1999,21,0
204,QSAR oral toxicity Data Set,8992,Physical,1024,10/1/2019,No,6042,1,0,0,0,0,0,0,0,0,0,0,0,1,0,0,0,1,1,0,1,0,0,0,0,0,0,0,1,"[['University of Milano', 'Milan', 'Italy', 'ITA']]",2019,10-2019,1,9207808
205,Epileptic Seizure Recognition Data Set,11500,Life,179,5/24/2017,No,110617,1,1,0,0,0,0,0,0,0,0,0,0,2,0,1,1,0,2,0,1,0,0,0,0,0,0,1,2,"[['Rochester Institute of Technology', 'Rochester, NY', 'United States', 'USA']]",2017,5-2017,3,2058500
206,Dow Jones Index Data Set,750,Business,16,10/23/2014,No,211539,0,1,0,0,0,0,0,0,0,0,0,0,1,0,1,1,0,2,0,1,0,0,0,0,0,0,1,2,"[['University of Maryland', 'College Park, MD', 'United States', 'USA']]",2014,10-2014,6,12000
207,Vertebral Column Data Set,310,Other,6,8/9/2011,No,170386,1,0,0,0,0,0,0,0,0,0,0,0,1,0,1,0,0,1,0,1,0,0,0,0,0,0,0,1,"[['Federal University of Ceará', 'Fortaleza', 'Brazil', 'BRA']]",2011,8-2011,9,1860
209,GNFUV Unmanned Surface Vehicles Sensor Data Set 2 Data Set,10190,Computer,6,9/13/2018,Yes,9780,1,1,0,0,0,0,1,0,0,0,0,0,3,0,1,0,0,1,0,0,1,0,0,0,0,0,0,1,"[['University of Glasgow', 'Glasgow', 'United Kingdom', 'GBR']]",2018,9-2018,2,61140
210,Ionosphere Data Set,351,Physical,34,1/1/1989,No,231746,1,0,0,0,0,0,0,0,0,0,0,0,1,0,1,1,0,2,0,1,0,0,0,0,0,0,0,2,"[['Johns-Hopkins University', 'Baltimore, MD', 'United States', 'USA']]",1989,1-1989,31,11934
211,UJIIndoorLoc Data Set,21048,Computer,529,9/18/2014,No,97057,1,0,0,0,0,0,0,0,0,0,0,0,1,0,1,1,0,2,0,1,1,0,0,0,0,0,0,2,"[['Universitat Politecnica de Catalunya', 'Barcelona', 'Spain', 'ESP'], ['Universitat Jaume I', 'Valencia', 'Spain', 'ESP']]",2014,9-2014,6,11134392
212,Dresses_Attribute_Sales Data Set,501,Computer,13,2/19/2014,Yes,109679,0,0,0,0,0,0,0,0,0,0,1,0,0,0,0,0,1,1,0,1,0,0,0,0,0,0,1,1,"[['Air University', 'Maxwell AFB, AL', 'United States', 'USA']]",2014,2-2014,6,6513
213,"Taxi Service Trajectory - Prediction Challenge, ECML PKDD 2015 Data Set",1710671,Computer,9,7/11/2015,Yes,81736,1,1,0,1,0,0,1,0,0,0,0,0,4,0,1,0,0,1,1,0,0,0,0,0,0,0,1,1,,2015,7-2015,5,15396039
214,IDA2016Challenge Data Set,76000,Computer,171,1/17/2017,Yes,16487,1,0,0,0,0,0,0,0,0,0,0,0,1,0,0,1,0,1,0,1,0,0,0,0,0,0,0,1,"[['Stockholm University', 'Stockholm', 'Sweden', 'SWE']]",2017,1-2017,3,12996000
215,Travel Reviews Data Set,980,Other,11,12/19/2018,No,70477,1,0,0,0,0,0,0,0,0,0,1,0,1,0,1,0,0,1,0,1,0,0,0,0,0,0,1,1,,2018,12-2018,2,10780
216,QSAR Bioconcentration classes dataset Data Set,779,Life,14,10/11/2019,No,5677,1,0,0,0,0,0,0,0,0,0,0,0,1,0,0,0,1,1,0,1,1,0,0,0,0,0,0,1,"[['University of Milano', 'Milan', 'Italy', 'ITA']]",2019,10-2019,1,10906
217,Letter Recognition Data Set,20000,Computer,16,1/1/1991,No,391541,1,0,0,0,0,0,0,0,0,0,0,0,1,0,0,1,0,1,0,1,0,0,0,0,0,0,0,1,"[['Northwestern University', 'Evanston, IL', 'United States', 'USA'], ['Odesta Corporation', 'Evanston, IL', 'United States', 'USA']]",1991,1-1991,29,320000
218,Polish companies bankruptcy data Data Set,10503,Business,64,4/11/2016,Yes,104739,1,0,0,0,0,0,0,0,0,0,0,0,1,0,1,0,0,1,0,1,0,0,0,0,0,0,0,1,"[['Warsaw University of Science and Technology', 'Warszawa', 'Poland', 'POL']]",2016,4-2016,4,672192
219,Simulated Falls and Daily Living Activities Data Set Data Set,3060,Life,138,6/6/2018,Yes,79305,0,1,0,0,0,0,0,0,0,0,0,0,1,0,0,1,0,1,0,1,0,0,0,0,0,0,0,1,"[['Bilkent University', 'Ankara', 'Turkey', 'TUR'], ['Gazi University', 'Ankara', 'Turkey', 'TUR']]",2018,6-2018,2,422280
220,Behavior of the urban traffic of the city of Sao Paulo in Brazil Data Set,135,Computer,18,12/12/2018,No,46554,1,1,0,0,0,0,0,0,0,0,0,0,2,0,1,1,0,2,0,1,1,0,0,0,0,0,0,2,"[['Universidade Nove de Julho', 'Sao Paulo', 'Brazil', 'BRA']]",2018,12-2018,2,2430
221,Detect Malacious Executable(AntiVirus) Data Set,373,Computer,513,3/3/2016,Yes,256103,1,0,0,0,0,0,0,0,0,0,0,0,1,0,1,0,0,1,0,1,0,0,0,0,0,0,0,1,"[['University of Mumbai', 'Mumbai', 'India', 'IND']]",2016,3-2016,4,191349
222,Physicochemical Properties of Protein Tertiary Structure Data Set,45730,Life,9,3/31/2013,No,54975,1,0,0,0,0,0,0,0,0,0,0,0,1,0,1,0,0,1,0,0,1,0,0,0,0,0,0,1,"[['Indian Institute of Information Technology & Management', 'Gwalior', 'India', 'IND']]",2013,3-2013,7,411570
223,Census-Income (KDD) Data Set,299285,Social,40,3/7/2000,Yes,174212,1,0,0,0,0,0,0,0,0,0,0,0,1,1,0,1,0,2,0,1,0,0,0,0,0,0,0,2,"[['Purdue University', 'West Lafayette, IN', 'United States', 'USA']]",2000,3-2000,20,11971400
224,PM2.5 Data of Five Chinese Cities Data Set,52854,Physical,86,7/18/2017,Yes,83868,1,1,0,0,0,0,0,0,0,0,0,0,2,0,1,1,0,2,0,0,1,0,0,0,0,0,0,2,"[['Peking University', 'Beijing', 'China', 'CHN']]",2017,7-2017,3,4545444
225,seeds Data Set,210,Life,7,9/29/2012,No,307657,1,0,0,0,0,0,0,0,0,0,0,0,1,0,1,0,0,1,0,1,0,0,0,0,0,0,1,1,"[['Polish Academy of Sciences', 'Warszawa', 'Poland', 'POL']]",2012,9-2012,8,1470
